{
  "$schema": "./schemas/app-config.schema.json",
  "name": "Video Speed Changer",
  "nameJa": "動画速度変更",
  "slug": "video-speed-changer",
  "version": "1.1.0",
  "description": "Change video speed locally from 0.25× to 4.00×, preview the result, choose audio behavior and quality, and save an MP4 with an editable file name.",
  "descriptionJa": "動画を0.25〜4.00倍で速度変更し、変換結果をプレビューしながら音声・画質・ファイル名を確認してMP4として保存できるブラウザーツールです。",
  "defaultLanguage": "auto",
  "repository": {
    "owner": "ttomohisa",
    "name": "htmlapps-video-speed-changer"
  },
  "build": {
    "output": "dist/index.html",
    "blockRuntimeNetwork": true,
    "selfExtract": {
      "enabled": true,
      "output": "dist/index.self-extract.html",
      "multiThreadOutput": "dist/index.mt.self-extract.html"
    },
    "sizeBudget": {
      "readableWarningMb": 8,
      "selfExtractWarningMb": 5
    },
    "multiThreadOutput": "dist/index.mt.html"
  }
}
